Keyword,Title
Reinforcement Learning,Method and system for generating an interactive kill chain view for training a machine learning model for identifying threats 
Reinforcement Learning,Methods and systems of diagnosing machine components using neural networks and having bandwidth allocation 
Reinforcement Learning,Underwater robot track control method and control system based on deep reinforcement learning 
Reinforcement Learning,Systems and methods for data processing and enterprise AI applications 
Reinforcement Learning,Automated behavioral and static analysis using an instrumented sandbox and machine learning classification for mobile security 
Reinforcement Learning,Methods for data monitoring with changeable routing of input channels 
Reinforcement Learning,Autonomous vehicle component maintenance and repair 
Reinforcement Learning,Parser for deriving user intent 
Reinforcement Learning,Assigning support tickets to support agents 
Reinforcement Learning,Learning data augmentation strategies for object detection 
Reinforcement Learning,Power grid reactive voltage control method based on two-stage deep reinforcement learning 
Reinforcement Learning,Ultra-dense edge computing network mobility management method based on deep reinforcement learning 
Reinforcement Learning,Rehabilitation training prescription self-adaptive recommendation method and system based on deep reinforcement learning 
Reinforcement Learning,Multi-unmanned aerial vehicle action decision method and device based on reinforcement learning 
Reinforcement Learning,Deep Q-network reinforcement learning for testing case selection and prioritization 
Reinforcement Learning,Method and device for resource allocation using attention-driven algorithm to achieve safety of autonomous driving using AVM and reinforcement learning {METHOD AND DEVICE FOR ATTENTION-DRIVEN RESOURCE ALLOCATION BY USING AVMAND REINFORCEMENT LER ACHIEVE SAFETY OF AUTONOMOUS DRIVERING} 
Reinforcement Learning,Multi-agent confrontation oriented reinforcement learning training optimization method and device 
Reinforcement Learning,Quantum computation through reinforcement learning 
Reinforcement Learning,Building neural networks for resource allocation for iterative workloads using reinforcement learning 
Reinforcement Learning,Multi-machine collaborative air combat planning method and system based on deep reinforcement learning 
Reinforcement Learning,Multi-agent reinforcement learning scheduling method and system and electronic equipment 
Reinforcement Learning,"Cooperative multi-goal, multi-agent, multi-stage reinforcement learning "
Reinforcement Learning,Radio access network control with deep reinforcement learning 
Reinforcement Learning,Multi-intersection signal lamp cooperative control method based on deep reinforcement learning 
Reinforcement Learning,Cluster electric vehicle charging behavior optimization method based on deep reinforcement learning 
Reinforcement Learning,"Recommendation method and recommendation apparatus based on deep reinforcement learning, and non-transitory computer-readable recording medium "
Reinforcement Learning,"Single intersection traffic signal control method, system and device based on deep reinforcement learning "
Reinforcement Learning,For hierarchical decomposition deep reinforcement learning for an artificial intelligence model 
Reinforcement Learning,Unmanned cluster task cooperation method based on multi-agent reinforcement learning 
Reinforcement Learning,Wireless network resource allocation method based on deep reinforcement learning 
Reinforcement Learning,Reinforcement learning model training through simulation 
Reinforcement Learning,"Non-complete information game method, device and system based on deep reinforcement learning and storage medium "
Reinforcement Learning,Furniture layout method and system based on piece-by-piece reinforcement learning technology 
Reinforcement Learning,Method for reinforcement learning using virtual environment generated by deep learning 
Reinforcement Learning,Systems and methods for orchestrating microservice containers interconnected via a service mesh in a multi-cloud environment based on a reinforcement learning policy 
Reinforcement Learning,Low-orbit satellite routing strategy method based on deep reinforcement learning architecture 
Reinforcement Learning,Reinforcement learning on autonomous vehicles 
Reinforcement Learning,Learning method and learning device for supporting reinforcement learning by using human driving data as training data to thereby perform personalized path planning 
Reinforcement Learning,Signal control apparatus and signal control method based on reinforcement learning 